{
  "appId": "TYPE.connect|PUBID.websan-solutions-inc|AID.moniroo-production-time-management|PAPPID.99952ea0-3c38-4d55-8375-dfdf221342e7",
  "appName": "Moniroo Production Time Management",
  "countries": [],
  "languages": [],
  "extends": [],
  "worksWellWith": [],
  "showLogo": false,
  "logoUrl": null
}
