{
  "appId": "TYPE.connect|PUBID.seerdynamicstechnologies1681408030348|AID.bc_purchase_request_rfq|PAPPID.43a689fd-e44c-4c4d-9ad0-ff944cfbf3bb",
  "appName": "Purchase Request & RFQ on Business central",
  "countries": [],
  "languages": [],
  "extends": [],
  "worksWellWith": [],
  "showLogo": false,
  "logoUrl": null
}
