{
  "appId": "PUBID.markmannmllerdatensystemegmbh1610701000601|AID.mumdat_ext_text_module_report_dispatch|PAPPID.57dad663-dd95-4d53-b15f-46df4f3ec4de",
  "appName": "m+m Ext. Text Module with Report Dispatch",
  "countries": [],
  "languages": [],
  "extends": [],
  "worksWellWith": [],
  "showLogo": false,
  "logoUrl": null
}
