{
  "appId": "PUBID.vistascloudllc1646347477273|AID.16_bulkcopyopenpurchaseinvoices|PAPPID.936f3930-af3b-4e22-afce-ac87be0e4ee9",
  "appName": "VISTAS Bulk Copy Open Purchase Invoices",
  "countries": [],
  "languages": [],
  "extends": [],
  "worksWellWith": [],
  "showLogo": false,
  "logoUrl": null
}
