{
  "appId": "TYPE.connect|PUBID.quantumquadsolutions1768544978440|AID.jobwork_offer_id|PAPPID.3723e243-3995-4228-b3db-5d76973b6738",
  "appName": "Job Work - Subcontracting & Trading Management for Dynamics 365 Business Central",
  "countries": [],
  "languages": [],
  "extends": [],
  "worksWellWith": [],
  "showLogo": false,
  "logoUrl": null
}
