{
  "appId": "PUBID.markmannmllerdatensystemegmbh1610701000601|AID.mumdat_sales_purchase_history|PAPPID.5dbd52e1-20e6-49e1-9d1c-adbf2e5a77c6",
  "appName": "m+m Sales Purchase History",
  "countries": [],
  "languages": [],
  "extends": [],
  "worksWellWith": [],
  "showLogo": false,
  "logoUrl": null
}
