{
  "appId": "PUBID.knowledgeandstrategy|AID.ks_traditional_chinese_language_pack_for_taiwan|PAPPID.bac2832a-c73f-4e97-a3a3-ea2031aecbe6",
  "appName": "Traditional Chinese Language Pack for Taiwan",
  "countries": [],
  "languages": [],
  "extends": [],
  "worksWellWith": [],
  "showLogo": false,
  "logoUrl": null
}
