{
  "appId": "PUBID.alfapeople|AID.apd365forbcargentina|PAPPID.661ad4cb-8480-4626-b79b-de34ee2de47d",
  "appName": "Argentina Localization for Microsoft Dynamics 365 Business Central",
  "countries": [],
  "languages": [],
  "extends": [],
  "worksWellWith": [],
  "showLogo": false,
  "logoUrl": null
}
