{
  "appId": "PUBID.markmannmllerdatensystemegmbh1610701000601|AID.mumdat_physical_inventory_item_tracking|PAPPID.8538c26e-e9e7-4fa8-bbdf-5faf8a00fa57",
  "appName": "m+m Physical Inventory Item Tracking",
  "countries": [],
  "languages": [],
  "extends": [],
  "worksWellWith": [],
  "showLogo": false,
  "logoUrl": null
}
