{
  "appId": "TYPE.connect|PUBID.centerstageinc1690983912338|AID.orocommerce|PAPPID.782a12eb-3d01-4417-a5ab-c2b789ae6487",
  "appName": "OroCommerce for Microsoft Dynamics 365 Business Central",
  "countries": [],
  "languages": [],
  "extends": [],
  "worksWellWith": [],
  "showLogo": false,
  "logoUrl": null
}
