{
  "appId": "PUBID.markmannmllerdatensystemegmbh1610701000601|AID.mumdat_ext_production_information|PAPPID.39273200-5970-45eb-abef-4e23d19e8c0e",
  "appName": "m+m Ext. Production Information",
  "countries": [],
  "languages": [],
  "extends": [],
  "worksWellWith": [],
  "showLogo": false,
  "logoUrl": null
}
