{
  "appId": "TYPE.connect|PUBID.fourvision|AID.recruitment-advanced-hrm-bc|PAPPID.0edb47b3-9976-4851-a95c-2a58d9fffd20",
  "appName": "Recruitment Management for Dynamics 365 Business Central",
  "countries": [],
  "languages": [],
  "extends": [],
  "worksWellWith": [],
  "showLogo": false,
  "logoUrl": null
}
