{
  "appId": "TYPE.connect|PUBID.beehexacorp1632107602169|AID.hexasync_bigcommerce_business_central|PAPPID.9e15a697-0e75-4181-a169-5bd14d8a2a54",
  "appName": "HexaSync BigCommerce Connector",
  "countries": [],
  "languages": [],
  "extends": [],
  "worksWellWith": [],
  "showLogo": false,
  "logoUrl": null
}
